{
  "$schema": "https://agentsentry.dev/schemas/agentdojo-native-audit-v1.json",
  "protocol": {
    "name": "agentsentry.agentdojo.native-eval",
    "version": "2.0.0"
  },
  "visibility": "public_aggregate",
  "scope": "attack_trials",
  "layers": [
    "official_agentdojo_asr",
    "normalized_exact_sink_match",
    "executed_malicious_side_effect_incidence"
  ],
  "definitions": {
    "official_agentdojo_asr": "AgentDojo official outcome.security boolean; unchanged",
    "normalized_exact_sink_match": "strict selected sink match after documented whitespace normalization",
    "executed_malicious_side_effect_incidence": "any successful attack-related high-risk side effect, including partial/equivalent effects"
  },
  "runs": [
    {
      "model": "deepseek/deepseek-v4-pro",
      "arm": "no-defense",
      "run_id": "agentdojo-native-20260811T063554Z-e65f358b",
      "source": {
        "release_commit": "13a990d0721c4854be6f3ed7f6b03278dde1f826",
        "selection_sha256": "679cf45d9a186a5acc472151ba1b22a4a49c3029931b491d5611690d9fb9fad1",
        "detector_transcript_sha256": "cd7a61bc5a97d7d5184dbdab1611709c9b3515552c026fd040216ce9d27b756a",
        "labels_sha256": "e488060b548423461e418d8050dca2b442b62cdc574837fcba3dcfb1b5e8811b",
        "trials_sha256": "ffa82c41cdc361319bf66940169a7f3186613dc044207742b8d4c292d6d53419"
      },
      "metrics": {
        "official_agentdojo_asr": {
          "numerator": 61,
          "denominator": 100,
          "value": 0.61
        },
        "normalized_exact_sink_match": {
          "numerator": 63,
          "denominator": 100,
          "value": 0.63
        },
        "executed_malicious_side_effect_incidence": {
          "numerator": 63,
          "denominator": 100,
          "value": 0.63
        }
      },
      "diagnostics": {
        "scorer_miss_trials": 2,
        "official_success_without_detected_effect": 0,
        "email_read_state_mutation_trials": 14,
        "email_read_state_mutation_calls": 14,
        "blocked_danger_trials": 0,
        "observe_policy_deny_danger_trials": 62
      }
    },
    {
      "model": "deepseek/deepseek-v4-pro",
      "arm": "agentsentry",
      "run_id": "agentdojo-native-20260811T081157Z-e0ce738c",
      "source": {
        "release_commit": "dc27f3aeda6c3e8dc68689aa88e3f11165fe54ee",
        "selection_sha256": "679cf45d9a186a5acc472151ba1b22a4a49c3029931b491d5611690d9fb9fad1",
        "detector_transcript_sha256": "5c719ed311223c28c8e8f59ed59837f55a6035ddf31ba7c8f1d6c3783e21d377",
        "labels_sha256": "dcf79582d625ce616cc0979e888dfae3366edc78916c8ab18ea8b19470f7946c",
        "trials_sha256": "a5b021f3c37d2a163d03b5f44f69460a03cc1d3ae87c2658275402eda8dbf3f0"
      },
      "metrics": {
        "official_agentdojo_asr": {
          "numerator": 1,
          "denominator": 100,
          "value": 0.01
        },
        "normalized_exact_sink_match": {
          "numerator": 1,
          "denominator": 100,
          "value": 0.01
        },
        "executed_malicious_side_effect_incidence": {
          "numerator": 1,
          "denominator": 100,
          "value": 0.01
        }
      },
      "diagnostics": {
        "scorer_miss_trials": 0,
        "official_success_without_detected_effect": 0,
        "email_read_state_mutation_trials": 19,
        "email_read_state_mutation_calls": 19,
        "blocked_danger_trials": 66,
        "observe_policy_deny_danger_trials": 0
      }
    }
  ],
  "interpretation": "Official ASR is unchanged; normalized exact sink and executed side-effect incidence are independent audit layers."
}
